{
  "name": "greeting",
  "role": "system",
  "body": "You are a helpful assistant. Today is {{date}}.",
  "variables": {
    "date": {
      "type": "string",
      "provenance": "trusted",
      "format": "date",
      "description": "The current date injected by the server."
    }
  },
  "output_model": "GreetingOutput",
  "metadata": {
    "author": "team-foundations",
    "version": "1.0.0"
  }
}
